role_id,role_title,role_description,required_skills
424,Machine Learning Administrator,"Responsible for flutter, pandas, pytorch, swift, node, django tasks and projects","flutter,pandas,pytorch,swift,node,django"
425,Business Scientist,"Responsible for unity, react, spark, cloud tasks and projects","unity,react,spark,cloud"
426,Business Designer,"Responsible for python, c#, pytorch tasks and projects","python,c#,pytorch"
427,Robotics Developer,"Responsible for css, html, git, figma, javascript, pandas tasks and projects","css,html,git,figma,javascript,pandas"
428,Blockchain Architect,"Responsible for flask, adobe xd, solidity, css tasks and projects","flask,adobe xd,solidity,css"
429,Frontend Administrator,"Responsible for react, css, adobe xd, cloud, pandas, solidity tasks and projects","react,css,adobe xd,cloud,pandas,solidity"
430,IoT Designer,"Responsible for figma, pytorch, kotlin tasks and projects","figma,pytorch,kotlin"
431,QA Engineer,"Responsible for docker, aws, spark, kubernetes tasks and projects","docker,aws,spark,kubernetes"
432,Cloud Scientist,"Responsible for tensorflow, unity, kubernetes tasks and projects","tensorflow,unity,kubernetes"
433,Machine Learning Developer,"Responsible for linux, node, figma, spark, cloud, sql tasks and projects","linux,node,figma,spark,cloud,sql"
434,UI/UX Manager,"Responsible for numpy, cloud, flutter, c#, sql, java tasks and projects","numpy,cloud,flutter,c#,sql,java"
435,Full Stack Architect,"Responsible for python, docker, flask, numpy, c++ tasks and projects","python,docker,flask,numpy,c++"
436,Marketing Manager,"Responsible for pandas, sql, javascript, cloud, tensorflow tasks and projects","pandas,sql,javascript,cloud,tensorflow"
437,Data Architect,"Responsible for cloud, linux, html tasks and projects","cloud,linux,html"
438,IoT Analyst,"Responsible for sql, node, tensorflow, react, java, linux tasks and projects","sql,node,tensorflow,react,java,linux"
439,Robotics Specialist,"Responsible for unity, kotlin, kubernetes tasks and projects","unity,kotlin,kubernetes"
440,Machine Learning Designer,"Responsible for unity, numpy, sql tasks and projects","unity,numpy,sql"
441,Marketing Designer,"Responsible for flutter, c#, react, python, spark, javascript tasks and projects","flutter,c#,react,python,spark,javascript"
442,Cloud Administrator,"Responsible for css, airflow, spark tasks and projects","css,airflow,spark"
443,Robotics Architect,"Responsible for javascript, pandas, css, sql tasks and projects","javascript,pandas,css,sql"
444,Cloud Engineer,"Responsible for swift, nlp, figma, sql tasks and projects","swift,nlp,figma,sql"
445,IoT Consultant,"Responsible for nlp, docker, node, airflow, flask, adobe xd tasks and projects","nlp,docker,node,airflow,flask,adobe xd"
446,Frontend Architect,"Responsible for pandas, numpy, aws, git, node tasks and projects","pandas,numpy,aws,git,node"
447,Product Specialist,"Responsible for flutter, solidity, pytorch tasks and projects","flutter,solidity,pytorch"
448,QA Administrator,"Responsible for nlp, azure, react, java, git, css tasks and projects","nlp,azure,react,java,git,css"
449,Blockchain Administrator,"Responsible for spark, azure, unity, css tasks and projects","spark,azure,unity,css"
450,QA Architect,"Responsible for c++, git, sql, react, azure, css tasks and projects","c++,git,sql,react,azure,css"
451,Data Specialist,"Responsible for unity, airflow, spark tasks and projects","unity,airflow,spark"
452,IoT Administrator,"Responsible for react, nlp, kotlin, swift, node tasks and projects","react,nlp,kotlin,swift,node"
453,Mobile Consultant,"Responsible for java, nlp, javascript, sql tasks and projects","java,nlp,javascript,sql"
454,AI Scientist,"Responsible for numpy, tensorflow, adobe xd, sql tasks and projects","numpy,tensorflow,adobe xd,sql"
455,Embedded Scientist,"Responsible for react, swift, airflow tasks and projects","react,swift,airflow"
456,Marketing Administrator,"Responsible for solidity, css, node, c++ tasks and projects","solidity,css,node,c++"
457,Game Developer,"Responsible for nlp, aws, linux tasks and projects","nlp,aws,linux"
458,Backend Manager,"Responsible for html, c#, unity tasks and projects","html,c#,unity"
459,Business Designer,"Responsible for c#, figma, java, nlp, react, spark tasks and projects","c#,figma,java,nlp,react,spark"
460,Product Engineer,"Responsible for java, pytorch, css, javascript, figma, kubernetes tasks and projects","java,pytorch,css,javascript,figma,kubernetes"
461,Frontend Developer,"Responsible for solidity, c++, azure tasks and projects","solidity,c++,azure"
462,Embedded Analyst,"Responsible for sql, react, nlp tasks and projects","sql,react,nlp"
463,Cloud Architect,"Responsible for node, adobe xd, django, solidity, flask tasks and projects","node,adobe xd,django,solidity,flask"
464,Blockchain Manager,"Responsible for tensorflow, java, figma, react tasks and projects","tensorflow,java,figma,react"
465,UI/UX Specialist,"Responsible for solidity, kubernetes, html, css, numpy, nlp tasks and projects","solidity,kubernetes,html,css,numpy,nlp"
466,Machine Learning Administrator,"Responsible for docker, pandas, node, html, azure tasks and projects","docker,pandas,node,html,azure"
467,Business Specialist,"Responsible for c#, spark, html, nlp tasks and projects","c#,spark,html,nlp"
468,IoT Specialist,"Responsible for unity, cloud, airflow, flask, azure, django tasks and projects","unity,cloud,airflow,flask,azure,django"
469,Frontend Analyst,"Responsible for c++, java, kubernetes, c#, tensorflow, kotlin tasks and projects","c++,java,kubernetes,c#,tensorflow,kotlin"
470,Robotics Developer,"Responsible for c#, tensorflow, aws, airflow, adobe xd, c++ tasks and projects","c#,tensorflow,aws,airflow,adobe xd,c++"
471,Robotics Manager,"Responsible for sql, docker, cloud, solidity, numpy, django tasks and projects","sql,docker,cloud,solidity,numpy,django"
472,Robotics Architect,"Responsible for javascript, tensorflow, numpy tasks and projects","javascript,tensorflow,numpy"
473,Embedded Scientist,"Responsible for pandas, unity, html, adobe xd, python tasks and projects","pandas,unity,html,adobe xd,python"
474,Blockchain Consultant,"Responsible for c++, nlp, kotlin tasks and projects","c++,nlp,kotlin"
475,Marketing Architect,"Responsible for c#, css, sql, javascript, kubernetes tasks and projects","c#,css,sql,javascript,kubernetes"
476,Full Stack Manager,"Responsible for unity, solidity, nlp tasks and projects","unity,solidity,nlp"
477,Data Analyst,"Responsible for css, kotlin, django, azure tasks and projects","css,kotlin,django,azure"
478,AI Analyst,"Responsible for c#, azure, adobe xd, linux tasks and projects","c#,azure,adobe xd,linux"
479,Product Consultant,"Responsible for cloud, c++, javascript, pytorch, flutter, django tasks and projects","cloud,c++,javascript,pytorch,flutter,django"
480,Backend Scientist,"Responsible for numpy, django, react, linux tasks and projects","numpy,django,react,linux"
481,Robotics Architect,"Responsible for figma, javascript, pandas, pytorch, git tasks and projects","figma,javascript,pandas,pytorch,git"
482,Mobile Architect,"Responsible for azure, react, swift, html tasks and projects","azure,react,swift,html"
483,Embedded Developer,"Responsible for figma, sql, cloud tasks and projects","figma,sql,cloud"
484,Backend Analyst,"Responsible for kubernetes, numpy, azure, sql, django tasks and projects","kubernetes,numpy,azure,sql,django"
485,Mobile Administrator,"Responsible for swift, spark, nlp, c++, git, pandas tasks and projects","swift,spark,nlp,c++,git,pandas"
486,Robotics Specialist,"Responsible for swift, react, nlp, spark, tensorflow tasks and projects","swift,react,nlp,spark,tensorflow"
487,Game Architect,"Responsible for cloud, solidity, docker tasks and projects","cloud,solidity,docker"
488,Security Analyst,"Responsible for azure, unity, kubernetes tasks and projects","azure,unity,kubernetes"
489,Mobile Designer,"Responsible for pandas, cloud, kubernetes, git tasks and projects","pandas,cloud,kubernetes,git"
490,UI/UX Analyst,"Responsible for adobe xd, kotlin, c++ tasks and projects","adobe xd,kotlin,c++"
491,IoT Consultant,"Responsible for c++, linux, flask tasks and projects","c++,linux,flask"
492,Backend Consultant,"Responsible for flutter, linux, node, aws, adobe xd, kotlin tasks and projects","flutter,linux,node,aws,adobe xd,kotlin"
493,Game Manager,"Responsible for flutter, unity, nlp, cloud, linux, c++ tasks and projects","flutter,unity,nlp,cloud,linux,c++"
494,IoT Manager,"Responsible for sql, spark, kubernetes tasks and projects","sql,spark,kubernetes"
495,Robotics Architect,"Responsible for kotlin, airflow, flutter tasks and projects","kotlin,airflow,flutter"
496,Cloud Consultant,"Responsible for unity, css, kubernetes, solidity, docker, cloud tasks and projects","unity,css,kubernetes,solidity,docker,cloud"
497,Data Specialist,"Responsible for java, figma, docker, airflow, flask, python tasks and projects","java,figma,docker,airflow,flask,python"
498,QA Engineer,"Responsible for numpy, sql, tensorflow, css, pytorch, pandas tasks and projects","numpy,sql,tensorflow,css,pytorch,pandas"
499,Marketing Architect,"Responsible for airflow, azure, unity tasks and projects","airflow,azure,unity"
500,DevOps Engineer,"Responsible for aws, solidity, javascript, pytorch, kubernetes tasks and projects","aws,solidity,javascript,pytorch,kubernetes"
501,QA Analyst,"Responsible for nlp, css, react tasks and projects","nlp,css,react"
502,Backend Engineer,"Responsible for figma, javascript, nlp, sql, node tasks and projects","figma,javascript,nlp,sql,node"
503,Machine Learning Specialist,"Responsible for figma, pytorch, c#, git tasks and projects","figma,pytorch,c#,git"
504,Product Consultant,"Responsible for linux, python, aws tasks and projects","linux,python,aws"
505,DevOps Consultant,"Responsible for git, python, flask, adobe xd, c++, kotlin tasks and projects","git,python,flask,adobe xd,c++,kotlin"
506,Mobile Consultant,"Responsible for numpy, git, html, pytorch, aws, nlp tasks and projects","numpy,git,html,pytorch,aws,nlp"
507,Full Stack Specialist,"Responsible for c++, css, pytorch tasks and projects","c++,css,pytorch"
508,Data Consultant,"Responsible for azure, flutter, css tasks and projects","azure,flutter,css"
509,IoT Analyst,"Responsible for tensorflow, react, azure, solidity, git tasks and projects","tensorflow,react,azure,solidity,git"
510,Business Administrator,"Responsible for aws, javascript, docker, cloud tasks and projects","aws,javascript,docker,cloud"
511,Game Manager,"Responsible for c#, pandas, cloud, flutter tasks and projects","c#,pandas,cloud,flutter"
512,Marketing Analyst,"Responsible for python, pytorch, docker, kubernetes tasks and projects","python,pytorch,docker,kubernetes"
513,Backend Analyst,"Responsible for kubernetes, flask, css, django, swift, node tasks and projects","kubernetes,flask,css,django,swift,node"
514,Game Specialist,"Responsible for git, java, html, docker tasks and projects","git,java,html,docker"
515,Game Designer,"Responsible for figma, flutter, c#, numpy tasks and projects","figma,flutter,c#,numpy"
516,Business Developer,"Responsible for tensorflow, spark, airflow, linux, azure, kotlin tasks and projects","tensorflow,spark,airflow,linux,azure,kotlin"
517,Full Stack Administrator,"Responsible for adobe xd, docker, unity, kubernetes tasks and projects","adobe xd,docker,unity,kubernetes"
518,Security Engineer,"Responsible for django, kotlin, tensorflow, figma, css, aws tasks and projects","django,kotlin,tensorflow,figma,css,aws"
519,Full Stack Designer,"Responsible for kubernetes, pandas, adobe xd tasks and projects","kubernetes,pandas,adobe xd"
520,Machine Learning Consultant,"Responsible for unity, react, spark, git, linux tasks and projects","unity,react,spark,git,linux"
521,Marketing Specialist,"Responsible for java, html, cloud, django, kotlin, numpy tasks and projects","java,html,cloud,django,kotlin,numpy"
522,Business Engineer,"Responsible for azure, numpy, tensorflow, javascript, nlp, swift tasks and projects","azure,numpy,tensorflow,javascript,nlp,swift"
523,Backend Consultant,"Responsible for flutter, kotlin, spark, css, tensorflow tasks and projects","flutter,kotlin,spark,css,tensorflow"
524,Product Manager,"Responsible for flutter, python, swift, pandas, css tasks and projects","flutter,python,swift,pandas,css"
525,Marketing Architect,"Responsible for kubernetes, html, cloud, pandas tasks and projects","kubernetes,html,cloud,pandas"
526,DevOps Analyst,"Responsible for python, unity, azure, c# tasks and projects","python,unity,azure,c#"
527,Business Specialist,"Responsible for tensorflow, adobe xd, sql, c#, swift, docker tasks and projects","tensorflow,adobe xd,sql,c#,swift,docker"
528,AI Developer,"Responsible for css, git, azure tasks and projects","css,git,azure"
529,DevOps Administrator,"Responsible for kubernetes, tensorflow, java, django, pandas tasks and projects","kubernetes,tensorflow,java,django,pandas"
530,DevOps Administrator,"Responsible for docker, airflow, unity, kubernetes tasks and projects","docker,airflow,unity,kubernetes"
531,AI Designer,"Responsible for linux, c#, unity, pandas, git, node tasks and projects","linux,c#,unity,pandas,git,node"
532,Frontend Architect,"Responsible for kubernetes, html, django tasks and projects","kubernetes,html,django"
533,Full Stack Administrator,"Responsible for adobe xd, git, swift tasks and projects","adobe xd,git,swift"
534,IoT Administrator,"Responsible for nlp, html, airflow, azure tasks and projects","nlp,html,airflow,azure"
535,Business Specialist,"Responsible for nlp, flutter, git, aws, pandas, swift tasks and projects","nlp,flutter,git,aws,pandas,swift"
536,Marketing Developer,"Responsible for pytorch, python, azure tasks and projects","pytorch,python,azure"
537,Cloud Analyst,"Responsible for pytorch, nlp, unity tasks and projects","pytorch,nlp,unity"
538,Embedded Consultant,"Responsible for airflow, flask, cloud, figma, unity, docker tasks and projects","airflow,flask,cloud,figma,unity,docker"
539,Machine Learning Designer,"Responsible for css, numpy, html, kubernetes, react tasks and projects","css,numpy,html,kubernetes,react"
540,IoT Scientist,"Responsible for swift, flask, aws tasks and projects","swift,flask,aws"
541,Product Consultant,"Responsible for numpy, kubernetes, spark, docker, flutter tasks and projects","numpy,kubernetes,spark,docker,flutter"
542,IoT Specialist,"Responsible for flask, tensorflow, pandas, numpy, sql, javascript tasks and projects","flask,tensorflow,pandas,numpy,sql,javascript"
543,IoT Consultant,"Responsible for node, pytorch, java, linux, unity, kubernetes tasks and projects","node,pytorch,java,linux,unity,kubernetes"
544,Business Specialist,"Responsible for swift, django, adobe xd, c#, airflow, linux tasks and projects","swift,django,adobe xd,c#,airflow,linux"
545,DevOps Administrator,"Responsible for linux, solidity, figma, aws, azure, kotlin tasks and projects","linux,solidity,figma,aws,azure,kotlin"
546,IoT Specialist,"Responsible for adobe xd, kubernetes, sql, css, aws tasks and projects","adobe xd,kubernetes,sql,css,aws"
547,Game Designer,"Responsible for pandas, spark, swift tasks and projects","pandas,spark,swift"
548,Cloud Specialist,"Responsible for css, pytorch, kotlin, linux, kubernetes, nlp tasks and projects","css,pytorch,kotlin,linux,kubernetes,nlp"
549,Business Analyst,"Responsible for cloud, html, css, flask tasks and projects","cloud,html,css,flask"
550,DevOps Administrator,"Responsible for django, javascript, react, airflow, docker tasks and projects","django,javascript,react,airflow,docker"
551,IoT Designer,"Responsible for c++, pytorch, tensorflow, airflow, spark, django tasks and projects","c++,pytorch,tensorflow,airflow,spark,django"
552,AI Scientist,"Responsible for react, docker, azure, swift, sql, airflow tasks and projects","react,docker,azure,swift,sql,airflow"
553,Cloud Scientist,"Responsible for spark, kubernetes, adobe xd, react, aws, java tasks and projects","spark,kubernetes,adobe xd,react,aws,java"
554,UI/UX Manager,"Responsible for spark, tensorflow, c++ tasks and projects","spark,tensorflow,c++"
555,Business Specialist,"Responsible for cloud, tensorflow, javascript, node tasks and projects","cloud,tensorflow,javascript,node"
556,Full Stack Scientist,"Responsible for solidity, node, c# tasks and projects","solidity,node,c#"
557,Embedded Analyst,"Responsible for c++, aws, adobe xd, html, django, swift tasks and projects","c++,aws,adobe xd,html,django,swift"
558,Security Manager,"Responsible for sql, html, flask tasks and projects","sql,html,flask"
559,Robotics Analyst,"Responsible for adobe xd, figma, c# tasks and projects","adobe xd,figma,c#"
560,Product Specialist,"Responsible for react, unity, swift, aws, flutter tasks and projects","react,unity,swift,aws,flutter"
561,Embedded Scientist,"Responsible for numpy, sql, cloud tasks and projects","numpy,sql,cloud"
562,Mobile Administrator,"Responsible for javascript, tensorflow, c# tasks and projects","javascript,tensorflow,c#"
563,Backend Engineer,"Responsible for figma, pandas, pytorch, java tasks and projects","figma,pandas,pytorch,java"
564,Cloud Consultant,"Responsible for kubernetes, cloud, html, figma tasks and projects","kubernetes,cloud,html,figma"
565,Game Architect,"Responsible for django, solidity, sql, c# tasks and projects","django,solidity,sql,c#"
566,DevOps Architect,"Responsible for cloud, adobe xd, flutter, nlp, c++ tasks and projects","cloud,adobe xd,flutter,nlp,c++"
567,Blockchain Analyst,"Responsible for docker, javascript, nlp tasks and projects","docker,javascript,nlp"
568,Security Architect,"Responsible for c++, airflow, azure tasks and projects","c++,airflow,azure"
569,Embedded Analyst,"Responsible for pytorch, swift, tensorflow, aws, unity tasks and projects","pytorch,swift,tensorflow,aws,unity"
570,DevOps Developer,"Responsible for sql, django, c# tasks and projects","sql,django,c#"
571,Frontend Designer,"Responsible for flutter, git, adobe xd tasks and projects","flutter,git,adobe xd"
572,Frontend Analyst,"Responsible for flask, django, python, flutter, figma, solidity tasks and projects","flask,django,python,flutter,figma,solidity"
573,Full Stack Architect,"Responsible for swift, django, solidity, figma, java tasks and projects","swift,django,solidity,figma,java"
574,Frontend Engineer,"Responsible for numpy, c++, python, unity tasks and projects","numpy,c++,python,unity"
575,Cloud Engineer,"Responsible for tensorflow, azure, airflow, cloud, react tasks and projects","tensorflow,azure,airflow,cloud,react"
576,Robotics Engineer,"Responsible for git, kotlin, node, kubernetes, figma tasks and projects","git,kotlin,node,kubernetes,figma"
577,IoT Engineer,"Responsible for javascript, aws, docker, pandas, pytorch, nlp tasks and projects","javascript,aws,docker,pandas,pytorch,nlp"
578,Robotics Engineer,"Responsible for aws, cloud, java tasks and projects","aws,cloud,java"
579,IoT Developer,"Responsible for flask, javascript, adobe xd, nlp, css tasks and projects","flask,javascript,adobe xd,nlp,css"
580,DevOps Analyst,"Responsible for swift, kubernetes, django, tensorflow tasks and projects","swift,kubernetes,django,tensorflow"
581,Full Stack Developer,"Responsible for django, javascript, kubernetes tasks and projects","django,javascript,kubernetes"
582,Business Designer,"Responsible for git, react, flutter, django tasks and projects","git,react,flutter,django"
583,Data Administrator,"Responsible for tensorflow, python, sql, javascript tasks and projects","tensorflow,python,sql,javascript"
584,Machine Learning Consultant,"Responsible for python, c++, airflow, numpy, git tasks and projects","python,c++,airflow,numpy,git"
585,Machine Learning Administrator,"Responsible for python, figma, html, node, kotlin tasks and projects","python,figma,html,node,kotlin"
586,AI Developer,"Responsible for unity, azure, swift, aws, spark tasks and projects","unity,azure,swift,aws,spark"
587,AI Manager,"Responsible for flutter, react, python, css, git, airflow tasks and projects","flutter,react,python,css,git,airflow"
588,Robotics Analyst,"Responsible for css, react, flutter, adobe xd tasks and projects","css,react,flutter,adobe xd"
589,UI/UX Engineer,"Responsible for kubernetes, solidity, css tasks and projects","kubernetes,solidity,css"
590,Blockchain Designer,"Responsible for sql, django, html tasks and projects","sql,django,html"
591,Data Developer,"Responsible for flutter, airflow, html, kotlin tasks and projects","flutter,airflow,html,kotlin"
592,Business Consultant,"Responsible for aws, django, pytorch, linux, html tasks and projects","aws,django,pytorch,linux,html"
593,Product Specialist,"Responsible for spark, css, javascript tasks and projects","spark,css,javascript"
594,Frontend Designer,"Responsible for tensorflow, css, git tasks and projects","tensorflow,css,git"
595,Game Designer,"Responsible for numpy, flask, azure tasks and projects","numpy,flask,azure"
596,AI Designer,"Responsible for css, kotlin, cloud, airflow, c#, figma tasks and projects","css,kotlin,cloud,airflow,c#,figma"
597,IoT Designer,"Responsible for linux, cloud, javascript tasks and projects","linux,cloud,javascript"
598,Embedded Administrator,"Responsible for css, numpy, html tasks and projects","css,numpy,html"
599,IoT Designer,"Responsible for python, java, unity, pytorch, cloud tasks and projects","python,java,unity,pytorch,cloud"
600,Game Scientist,"Responsible for git, kubernetes, docker, aws, pytorch, sql tasks and projects","git,kubernetes,docker,aws,pytorch,sql"
601,Embedded Developer,"Responsible for unity, c++, swift, java tasks and projects","unity,c++,swift,java"
602,Data Manager,"Responsible for nlp, pytorch, unity, solidity, airflow tasks and projects","nlp,pytorch,unity,solidity,airflow"
603,AI Administrator,"Responsible for python, java, flutter tasks and projects","python,java,flutter"
604,Mobile Developer,"Responsible for node, kotlin, c# tasks and projects","node,kotlin,c#"
605,AI Administrator,"Responsible for python, flask, nlp tasks and projects","python,flask,nlp"
606,Backend Designer,"Responsible for unity, c#, html, pytorch, javascript tasks and projects","unity,c#,html,pytorch,javascript"
607,Business Developer,"Responsible for linux, aws, solidity, airflow, sql, java tasks and projects","linux,aws,solidity,airflow,sql,java"
608,Full Stack Specialist,"Responsible for flutter, azure, sql, linux, aws, figma tasks and projects","flutter,azure,sql,linux,aws,figma"
609,Machine Learning Consultant,"Responsible for react, sql, flutter tasks and projects","react,sql,flutter"
610,Business Specialist,"Responsible for kubernetes, python, figma, flask, c#, javascript tasks and projects","kubernetes,python,figma,flask,c#,javascript"
611,Cloud Manager,"Responsible for airflow, flutter, python, nlp tasks and projects","airflow,flutter,python,nlp"
612,Data Consultant,"Responsible for docker, azure, django, tensorflow, html, solidity tasks and projects","docker,azure,django,tensorflow,html,solidity"
613,Machine Learning Architect,"Responsible for solidity, docker, python tasks and projects","solidity,docker,python"
614,Business Administrator,"Responsible for flask, nlp, html, c#, pytorch tasks and projects","flask,nlp,html,c#,pytorch"
615,UI/UX Architect,"Responsible for swift, pytorch, azure, node, sql, flutter tasks and projects","swift,pytorch,azure,node,sql,flutter"
616,AI Scientist,"Responsible for pandas, swift, cloud, solidity tasks and projects","pandas,swift,cloud,solidity"
617,Business Scientist,"Responsible for solidity, flutter, cloud, adobe xd, pytorch, git tasks and projects","solidity,flutter,cloud,adobe xd,pytorch,git"
618,Product Engineer,"Responsible for java, adobe xd, react, python tasks and projects","java,adobe xd,react,python"
619,QA Scientist,"Responsible for adobe xd, django, html, java tasks and projects","adobe xd,django,html,java"
620,Product Manager,"Responsible for javascript, swift, django, sql, nlp tasks and projects","javascript,swift,django,sql,nlp"
621,Frontend Architect,"Responsible for cloud, c++, kubernetes, java tasks and projects","cloud,c++,kubernetes,java"
622,AI Developer,"Responsible for kubernetes, django, git, node, pandas, html tasks and projects","kubernetes,django,git,node,pandas,html"
623,Embedded Developer,"Responsible for javascript, nlp, html tasks and projects","javascript,nlp,html"
624,Backend Developer,"Responsible for kubernetes, adobe xd, spark tasks and projects","kubernetes,adobe xd,spark"
625,UI/UX Manager,"Responsible for azure, python, c++, flutter, figma, html tasks and projects","azure,python,c++,flutter,figma,html"
626,Machine Learning Consultant,"Responsible for swift, azure, python, kotlin, airflow, solidity tasks and projects","swift,azure,python,kotlin,airflow,solidity"
627,Cloud Specialist,"Responsible for linux, aws, pandas, pytorch, css tasks and projects","linux,aws,pandas,pytorch,css"
628,Data Consultant,"Responsible for airflow, node, c++ tasks and projects","airflow,node,c++"
629,Data Designer,"Responsible for flutter, javascript, nlp tasks and projects","flutter,javascript,nlp"
630,QA Analyst,"Responsible for airflow, django, kotlin, sql, docker, tensorflow tasks and projects","airflow,django,kotlin,sql,docker,tensorflow"
631,Embedded Architect,"Responsible for spark, react, pytorch, node, html tasks and projects","spark,react,pytorch,node,html"
632,Game Engineer,"Responsible for flutter, node, django, c# tasks and projects","flutter,node,django,c#"
633,DevOps Administrator,"Responsible for numpy, sql, adobe xd tasks and projects","numpy,sql,adobe xd"
634,Blockchain Manager,"Responsible for flask, unity, nlp, kubernetes tasks and projects","flask,unity,nlp,kubernetes"
635,Security Administrator,"Responsible for tensorflow, css, pytorch, spark, kotlin, solidity tasks and projects","tensorflow,css,pytorch,spark,kotlin,solidity"
