role_id,role_title,role_description,required_skills
636,Cloud Administrator,"Responsible for spark, c++, css, figma, tensorflow tasks and projects","spark,c++,css,figma,tensorflow"
637,Full Stack Developer,"Responsible for javascript, swift, spark, figma, c++, numpy tasks and projects","javascript,swift,spark,figma,c++,numpy"
638,Mobile Analyst,"Responsible for c++, azure, git, django, pandas tasks and projects","c++,azure,git,django,pandas"
639,Mobile Engineer,"Responsible for git, node, nlp, django, spark, java tasks and projects","git,node,nlp,django,spark,java"
640,Game Developer,"Responsible for pandas, html, css tasks and projects","pandas,html,css"
641,Marketing Architect,"Responsible for java, css, unity tasks and projects","java,css,unity"
642,IoT Designer,"Responsible for figma, docker, flutter, cloud, swift tasks and projects","figma,docker,flutter,cloud,swift"
643,Blockchain Engineer,"Responsible for solidity, adobe xd, numpy, flask tasks and projects","solidity,adobe xd,numpy,flask"
644,IoT Designer,"Responsible for tensorflow, unity, swift, flutter tasks and projects","tensorflow,unity,swift,flutter"
645,Mobile Consultant,"Responsible for react, css, django, c++, node, unity tasks and projects","react,css,django,c++,node,unity"
646,Embedded Scientist,"Responsible for git, node, java tasks and projects","git,node,java"
647,Full Stack Designer,"Responsible for nlp, kotlin, spark tasks and projects","nlp,kotlin,spark"
648,Security Architect,"Responsible for pytorch, sql, kotlin, adobe xd, spark, css tasks and projects","pytorch,sql,kotlin,adobe xd,spark,css"
649,AI Scientist,"Responsible for css, python, solidity, tensorflow, flask tasks and projects","css,python,solidity,tensorflow,flask"
650,Cloud Administrator,"Responsible for flutter, pytorch, kubernetes, azure, tensorflow tasks and projects","flutter,pytorch,kubernetes,azure,tensorflow"
651,Marketing Architect,"Responsible for flutter, azure, unity, cloud tasks and projects","flutter,azure,unity,cloud"
652,AI Architect,"Responsible for css, aws, django tasks and projects","css,aws,django"
653,Frontend Engineer,"Responsible for cloud, docker, aws, kubernetes, html, javascript tasks and projects","cloud,docker,aws,kubernetes,html,javascript"
654,Business Engineer,"Responsible for numpy, adobe xd, html, flutter tasks and projects","numpy,adobe xd,html,flutter"
655,Game Specialist,"Responsible for sql, flutter, react tasks and projects","sql,flutter,react"
656,Cloud Architect,"Responsible for html, flutter, tensorflow tasks and projects","html,flutter,tensorflow"
657,Robotics Administrator,"Responsible for kubernetes, linux, aws, pandas, numpy tasks and projects","kubernetes,linux,aws,pandas,numpy"
658,Business Scientist,"Responsible for adobe xd, linux, django, javascript, java, cloud tasks and projects","adobe xd,linux,django,javascript,java,cloud"
659,DevOps Specialist,"Responsible for java, swift, javascript tasks and projects","java,swift,javascript"
660,UI/UX Architect,"Responsible for spark, flutter, pytorch, java, javascript tasks and projects","spark,flutter,pytorch,java,javascript"
661,Security Analyst,"Responsible for sql, nlp, airflow tasks and projects","sql,nlp,airflow"
662,Cloud Scientist,"Responsible for nlp, numpy, django, flutter, kotlin tasks and projects","nlp,numpy,django,flutter,kotlin"
663,Mobile Developer,"Responsible for kotlin, css, docker, swift tasks and projects","kotlin,css,docker,swift"
664,Mobile Engineer,"Responsible for c++, nlp, python, spark, java, unity tasks and projects","c++,nlp,python,spark,java,unity"
665,Business Analyst,"Responsible for solidity, cloud, kubernetes, flutter, figma, node tasks and projects","solidity,cloud,kubernetes,flutter,figma,node"
666,Blockchain Administrator,"Responsible for swift, tensorflow, spark, nlp, html tasks and projects","swift,tensorflow,spark,nlp,html"
667,Machine Learning Engineer,"Responsible for javascript, solidity, kotlin, java tasks and projects","javascript,solidity,kotlin,java"
668,Embedded Developer,"Responsible for pandas, html, c++, airflow tasks and projects","pandas,html,c++,airflow"
669,Security Specialist,"Responsible for azure, c#, git, kubernetes, numpy tasks and projects","azure,c#,git,kubernetes,numpy"
670,IoT Analyst,"Responsible for html, linux, spark, kubernetes, c# tasks and projects","html,linux,spark,kubernetes,c#"
671,DevOps Manager,"Responsible for pytorch, unity, django, java, flutter, cloud tasks and projects","pytorch,unity,django,java,flutter,cloud"
672,Robotics Engineer,"Responsible for node, kubernetes, react, flutter, java tasks and projects","node,kubernetes,react,flutter,java"
673,Blockchain Designer,"Responsible for html, flutter, pandas tasks and projects","html,flutter,pandas"
674,Machine Learning Manager,"Responsible for css, c#, figma tasks and projects","css,c#,figma"
675,Full Stack Administrator,"Responsible for node, git, html, spark tasks and projects","node,git,html,spark"
676,UI/UX Architect,"Responsible for django, pandas, flask tasks and projects","django,pandas,flask"
677,Machine Learning Architect,"Responsible for docker, kubernetes, azure, spark, python, c++ tasks and projects","docker,kubernetes,azure,spark,python,c++"
678,Blockchain Specialist,"Responsible for linux, git, nlp, c#, pytorch tasks and projects","linux,git,nlp,c#,pytorch"
679,Backend Scientist,"Responsible for java, c++, html, adobe xd tasks and projects","java,c++,html,adobe xd"
680,Backend Scientist,"Responsible for node, solidity, tensorflow tasks and projects","node,solidity,tensorflow"
681,DevOps Engineer,"Responsible for html, aws, java, nlp, solidity tasks and projects","html,aws,java,nlp,solidity"
682,Embedded Engineer,"Responsible for git, swift, django, css, kotlin tasks and projects","git,swift,django,css,kotlin"
683,Product Developer,"Responsible for solidity, node, git tasks and projects","solidity,node,git"
684,Robotics Scientist,"Responsible for c#, linux, cloud, swift, html tasks and projects","c#,linux,cloud,swift,html"
685,Data Manager,"Responsible for css, airflow, c#, javascript, sql, flutter tasks and projects","css,airflow,c#,javascript,sql,flutter"
686,Full Stack Engineer,"Responsible for flask, pandas, html tasks and projects","flask,pandas,html"
687,Marketing Architect,"Responsible for pytorch, css, flutter, git, tensorflow tasks and projects","pytorch,css,flutter,git,tensorflow"
688,Machine Learning Engineer,"Responsible for swift, c++, javascript, node, cloud tasks and projects","swift,c++,javascript,node,cloud"
689,Game Designer,"Responsible for tensorflow, numpy, react tasks and projects","tensorflow,numpy,react"
690,IoT Analyst,"Responsible for aws, adobe xd, javascript, html, c++, docker tasks and projects","aws,adobe xd,javascript,html,c++,docker"
691,Robotics Administrator,"Responsible for linux, pytorch, kotlin, c#, airflow, django tasks and projects","linux,pytorch,kotlin,c#,airflow,django"
692,Blockchain Architect,"Responsible for node, aws, spark, javascript tasks and projects","node,aws,spark,javascript"
693,QA Engineer,"Responsible for sql, flutter, airflow, figma, javascript, html tasks and projects","sql,flutter,airflow,figma,javascript,html"
694,Business Developer,"Responsible for unity, aws, linux, java, docker, nlp tasks and projects","unity,aws,linux,java,docker,nlp"
695,AI Analyst,"Responsible for unity, aws, html, nlp, tensorflow tasks and projects","unity,aws,html,nlp,tensorflow"
696,Game Developer,"Responsible for pandas, pytorch, node, react, swift, unity tasks and projects","pandas,pytorch,node,react,swift,unity"
697,UI/UX Manager,"Responsible for solidity, pandas, tensorflow, html, azure, pytorch tasks and projects","solidity,pandas,tensorflow,html,azure,pytorch"
698,IoT Administrator,"Responsible for cloud, css, flask tasks and projects","cloud,css,flask"
699,AI Engineer,"Responsible for css, unity, adobe xd, flask tasks and projects","css,unity,adobe xd,flask"
700,UI/UX Administrator,"Responsible for pytorch, flutter, pandas, kotlin, css, html tasks and projects","pytorch,flutter,pandas,kotlin,css,html"
701,Product Consultant,"Responsible for linux, python, figma, swift tasks and projects","linux,python,figma,swift"
702,DevOps Scientist,"Responsible for css, swift, javascript, docker tasks and projects","css,swift,javascript,docker"
703,Embedded Developer,"Responsible for react, spark, kotlin, node, c++, kubernetes tasks and projects","react,spark,kotlin,node,c++,kubernetes"
704,Business Administrator,"Responsible for css, solidity, figma, sql, git, pytorch tasks and projects","css,solidity,figma,sql,git,pytorch"
705,IoT Developer,"Responsible for html, docker, pandas, django, css tasks and projects","html,docker,pandas,django,css"
706,UI/UX Architect,"Responsible for linux, flask, html, swift tasks and projects","linux,flask,html,swift"
707,Game Designer,"Responsible for tensorflow, linux, c++, unity, java tasks and projects","tensorflow,linux,c++,unity,java"
708,DevOps Manager,"Responsible for solidity, azure, linux, react, css tasks and projects","solidity,azure,linux,react,css"
709,Backend Consultant,"Responsible for java, linux, c++ tasks and projects","java,linux,c++"
710,IoT Specialist,"Responsible for c++, flask, linux, html tasks and projects","c++,flask,linux,html"
711,Robotics Engineer,"Responsible for javascript, docker, pandas, aws tasks and projects","javascript,docker,pandas,aws"
712,Machine Learning Administrator,"Responsible for azure, node, pytorch, flutter, nlp tasks and projects","azure,node,pytorch,flutter,nlp"
713,DevOps Engineer,"Responsible for git, docker, adobe xd, kotlin, javascript tasks and projects","git,docker,adobe xd,kotlin,javascript"
714,Mobile Architect,"Responsible for sql, aws, figma, spark, docker, pandas tasks and projects","sql,aws,figma,spark,docker,pandas"
715,Data Manager,"Responsible for cloud, aws, git, django tasks and projects","cloud,aws,git,django"
716,Game Consultant,"Responsible for linux, cloud, solidity, adobe xd, python tasks and projects","linux,cloud,solidity,adobe xd,python"
717,Robotics Specialist,"Responsible for airflow, c++, java, pandas, linux tasks and projects","airflow,c++,java,pandas,linux"
718,Mobile Scientist,"Responsible for html, kotlin, linux, kubernetes, javascript, airflow tasks and projects","html,kotlin,linux,kubernetes,javascript,airflow"
719,UI/UX Manager,"Responsible for pytorch, django, tensorflow, c++, docker tasks and projects","pytorch,django,tensorflow,c++,docker"
720,Machine Learning Developer,"Responsible for aws, swift, python, c++, node tasks and projects","aws,swift,python,c++,node"
721,UI/UX Administrator,"Responsible for html, kotlin, flutter tasks and projects","html,kotlin,flutter"
722,Security Consultant,"Responsible for azure, docker, html, sql, linux tasks and projects","azure,docker,html,sql,linux"
723,QA Developer,"Responsible for docker, flutter, airflow, kubernetes, figma tasks and projects","docker,flutter,airflow,kubernetes,figma"
724,Blockchain Specialist,"Responsible for node, java, adobe xd tasks and projects","node,java,adobe xd"
725,Product Architect,"Responsible for adobe xd, node, kubernetes, c#, css tasks and projects","adobe xd,node,kubernetes,c#,css"
726,Embedded Manager,"Responsible for java, tensorflow, javascript, sql tasks and projects","java,tensorflow,javascript,sql"
727,Mobile Developer,"Responsible for java, flask, swift, cloud tasks and projects","java,flask,swift,cloud"
728,Embedded Developer,"Responsible for html, unity, spark, tensorflow tasks and projects","html,unity,spark,tensorflow"
729,Game Architect,"Responsible for flutter, tensorflow, cloud, airflow tasks and projects","flutter,tensorflow,cloud,airflow"
730,Frontend Specialist,"Responsible for kotlin, c#, cloud, unity tasks and projects","kotlin,c#,cloud,unity"
731,Data Administrator,"Responsible for swift, kotlin, flutter tasks and projects","swift,kotlin,flutter"
732,Game Analyst,"Responsible for html, nlp, css, kotlin, airflow tasks and projects","html,nlp,css,kotlin,airflow"
733,Product Engineer,"Responsible for adobe xd, docker, figma, swift, react, unity tasks and projects","adobe xd,docker,figma,swift,react,unity"
734,Full Stack Manager,"Responsible for swift, c#, react, node, figma, numpy tasks and projects","swift,c#,react,node,figma,numpy"
735,Mobile Consultant,"Responsible for django, numpy, adobe xd, aws tasks and projects","django,numpy,adobe xd,aws"
736,IoT Architect,"Responsible for airflow, sql, git, javascript tasks and projects","airflow,sql,git,javascript"
737,Embedded Manager,"Responsible for numpy, kotlin, nlp, unity tasks and projects","numpy,kotlin,nlp,unity"
738,Product Analyst,"Responsible for javascript, git, adobe xd, azure, solidity, css tasks and projects","javascript,git,adobe xd,azure,solidity,css"
739,Security Architect,"Responsible for c++, sql, nlp, python, node tasks and projects","c++,sql,nlp,python,node"
740,Backend Analyst,"Responsible for spark, azure, adobe xd, flask, unity tasks and projects","spark,azure,adobe xd,flask,unity"
741,UI/UX Specialist,"Responsible for adobe xd, nlp, pytorch, swift, cloud, linux tasks and projects","adobe xd,nlp,pytorch,swift,cloud,linux"
742,Backend Designer,"Responsible for spark, figma, java, sql, python tasks and projects","spark,figma,java,sql,python"
743,Embedded Consultant,"Responsible for flutter, kubernetes, javascript, linux, flask tasks and projects","flutter,kubernetes,javascript,linux,flask"
744,QA Scientist,"Responsible for kotlin, linux, flutter tasks and projects","kotlin,linux,flutter"
745,Embedded Administrator,"Responsible for html, figma, node, python, nlp, sql tasks and projects","html,figma,node,python,nlp,sql"
746,Game Designer,"Responsible for react, pytorch, figma, c++ tasks and projects","react,pytorch,figma,c++"
747,DevOps Manager,"Responsible for pytorch, css, adobe xd, flask, linux tasks and projects","pytorch,css,adobe xd,flask,linux"
748,DevOps Architect,"Responsible for unity, c++, docker, node, react tasks and projects","unity,c++,docker,node,react"
749,Frontend Administrator,"Responsible for pandas, react, figma tasks and projects","pandas,react,figma"
750,Marketing Consultant,"Responsible for react, linux, spark, java, pandas tasks and projects","react,linux,spark,java,pandas"
751,Marketing Developer,"Responsible for docker, azure, kubernetes, numpy, react, flutter tasks and projects","docker,azure,kubernetes,numpy,react,flutter"
752,Marketing Designer,"Responsible for azure, figma, solidity, pytorch, adobe xd tasks and projects","azure,figma,solidity,pytorch,adobe xd"
753,Embedded Designer,"Responsible for react, figma, c++ tasks and projects","react,figma,c++"
754,Full Stack Administrator,"Responsible for django, unity, react tasks and projects","django,unity,react"
755,Frontend Architect,"Responsible for c#, swift, node, css, aws, solidity tasks and projects","c#,swift,node,css,aws,solidity"
756,UI/UX Administrator,"Responsible for docker, solidity, javascript tasks and projects","docker,solidity,javascript"
757,Blockchain Manager,"Responsible for adobe xd, html, aws tasks and projects","adobe xd,html,aws"
758,Product Administrator,"Responsible for docker, nlp, tensorflow, kotlin tasks and projects","docker,nlp,tensorflow,kotlin"
759,Machine Learning Scientist,"Responsible for css, cloud, tensorflow, git, django tasks and projects","css,cloud,tensorflow,git,django"
760,Full Stack Engineer,"Responsible for nlp, figma, kotlin, linux tasks and projects","nlp,figma,kotlin,linux"
761,IoT Administrator,"Responsible for swift, html, kubernetes, javascript, pytorch, pandas tasks and projects","swift,html,kubernetes,javascript,pytorch,pandas"
762,Robotics Analyst,"Responsible for aws, solidity, css, c# tasks and projects","aws,solidity,css,c#"
763,Machine Learning Architect,"Responsible for figma, adobe xd, tensorflow tasks and projects","figma,adobe xd,tensorflow"
764,Robotics Architect,"Responsible for docker, flask, node tasks and projects","docker,flask,node"
765,Embedded Administrator,"Responsible for docker, java, django tasks and projects","docker,java,django"
766,Frontend Consultant,"Responsible for aws, swift, azure, tensorflow tasks and projects","aws,swift,azure,tensorflow"
767,Backend Specialist,"Responsible for aws, react, figma, c#, adobe xd tasks and projects","aws,react,figma,c#,adobe xd"
768,Machine Learning Engineer,"Responsible for adobe xd, django, azure, nlp, linux, kotlin tasks and projects","adobe xd,django,azure,nlp,linux,kotlin"
769,Backend Developer,"Responsible for kubernetes, pandas, flask, kotlin tasks and projects","kubernetes,pandas,flask,kotlin"
770,Backend Analyst,"Responsible for linux, html, kotlin, airflow, aws, solidity tasks and projects","linux,html,kotlin,airflow,aws,solidity"
771,DevOps Designer,"Responsible for adobe xd, c++, pytorch tasks and projects","adobe xd,c++,pytorch"
772,DevOps Consultant,"Responsible for azure, spark, kubernetes, python, git tasks and projects","azure,spark,kubernetes,python,git"
773,Frontend Engineer,"Responsible for tensorflow, nlp, python, spark, kotlin, adobe xd tasks and projects","tensorflow,nlp,python,spark,kotlin,adobe xd"
774,Robotics Specialist,"Responsible for figma, pytorch, java, numpy tasks and projects","figma,pytorch,java,numpy"
775,IoT Analyst,"Responsible for pytorch, c++, c#, solidity, aws, swift tasks and projects","pytorch,c++,c#,solidity,aws,swift"
776,AI Engineer,"Responsible for git, docker, css, solidity, django, java tasks and projects","git,docker,css,solidity,django,java"
777,Machine Learning Designer,"Responsible for kubernetes, flutter, sql tasks and projects","kubernetes,flutter,sql"
778,Embedded Manager,"Responsible for c#, flask, python, git, unity, figma tasks and projects","c#,flask,python,git,unity,figma"
779,Machine Learning Specialist,"Responsible for sql, cloud, swift, react, pandas, c++ tasks and projects","sql,cloud,swift,react,pandas,c++"
780,Cloud Engineer,"Responsible for c#, numpy, pandas, css tasks and projects","c#,numpy,pandas,css"
781,Mobile Manager,"Responsible for solidity, airflow, python, java tasks and projects","solidity,airflow,python,java"
782,UI/UX Consultant,"Responsible for unity, html, swift, c#, css tasks and projects","unity,html,swift,c#,css"
783,Security Developer,"Responsible for node, aws, flutter, react, figma, pandas tasks and projects","node,aws,flutter,react,figma,pandas"
784,Blockchain Engineer,"Responsible for cloud, kotlin, pandas tasks and projects","cloud,kotlin,pandas"
785,Mobile Analyst,"Responsible for tensorflow, java, react, flutter, airflow tasks and projects","tensorflow,java,react,flutter,airflow"
786,DevOps Manager,"Responsible for docker, python, c++, adobe xd, spark tasks and projects","docker,python,c++,adobe xd,spark"
787,Product Engineer,"Responsible for java, solidity, django tasks and projects","java,solidity,django"
788,Mobile Consultant,"Responsible for javascript, react, sql, aws tasks and projects","javascript,react,sql,aws"
789,Frontend Designer,"Responsible for node, flask, solidity tasks and projects","node,flask,solidity"
790,Frontend Developer,"Responsible for numpy, unity, node, docker, airflow, adobe xd tasks and projects","numpy,unity,node,docker,airflow,adobe xd"
791,Security Scientist,"Responsible for cloud, unity, css tasks and projects","cloud,unity,css"
792,Mobile Scientist,"Responsible for kubernetes, javascript, c#, kotlin tasks and projects","kubernetes,javascript,c#,kotlin"
793,Data Specialist,"Responsible for sql, c++, adobe xd tasks and projects","sql,c++,adobe xd"
794,Product Manager,"Responsible for kotlin, kubernetes, python tasks and projects","kotlin,kubernetes,python"
795,Mobile Specialist,"Responsible for python, figma, c++, nlp, docker, django tasks and projects","python,figma,c++,nlp,docker,django"
796,UI/UX Scientist,"Responsible for react, spark, unity tasks and projects","react,spark,unity"
797,Cloud Consultant,"Responsible for c#, swift, tensorflow, airflow, aws tasks and projects","c#,swift,tensorflow,airflow,aws"
798,QA Consultant,"Responsible for tensorflow, pandas, numpy, flask, unity, docker tasks and projects","tensorflow,pandas,numpy,flask,unity,docker"
799,QA Engineer,"Responsible for aws, javascript, tensorflow, git, kubernetes tasks and projects","aws,javascript,tensorflow,git,kubernetes"
800,Full Stack Developer,"Responsible for react, docker, node tasks and projects","react,docker,node"
801,Blockchain Developer,"Responsible for tensorflow, numpy, azure, spark, python tasks and projects","tensorflow,numpy,azure,spark,python"
802,DevOps Developer,"Responsible for javascript, c#, unity tasks and projects","javascript,c#,unity"
803,Product Designer,"Responsible for kubernetes, aws, pandas, tensorflow, css tasks and projects","kubernetes,aws,pandas,tensorflow,css"
804,Frontend Administrator,"Responsible for git, numpy, html, kotlin, react, adobe xd tasks and projects","git,numpy,html,kotlin,react,adobe xd"
805,Machine Learning Architect,"Responsible for aws, figma, cloud, linux, react, flutter tasks and projects","aws,figma,cloud,linux,react,flutter"
806,Security Scientist,"Responsible for javascript, docker, kotlin, python, c# tasks and projects","javascript,docker,kotlin,python,c#"
807,Game Manager,"Responsible for pandas, node, python tasks and projects","pandas,node,python"
808,UI/UX Architect,"Responsible for java, c++, c# tasks and projects","java,c++,c#"
809,Embedded Designer,"Responsible for azure, c#, node, aws tasks and projects","azure,c#,node,aws"
810,QA Specialist,"Responsible for cloud, react, unity, spark, css, linux tasks and projects","cloud,react,unity,spark,css,linux"
811,Machine Learning Developer,"Responsible for azure, javascript, django, node, unity tasks and projects","azure,javascript,django,node,unity"
812,AI Consultant,"Responsible for kotlin, kubernetes, git, node tasks and projects","kotlin,kubernetes,git,node"
813,Frontend Engineer,"Responsible for javascript, git, pytorch, spark, aws, c# tasks and projects","javascript,git,pytorch,spark,aws,c#"
814,Mobile Designer,"Responsible for c++, adobe xd, figma, tensorflow, git tasks and projects","c++,adobe xd,figma,tensorflow,git"
815,Blockchain Developer,"Responsible for unity, flask, linux, azure, flutter tasks and projects","unity,flask,linux,azure,flutter"
816,Frontend Architect,"Responsible for python, docker, tensorflow tasks and projects","python,docker,tensorflow"
817,Machine Learning Designer,"Responsible for flask, java, django, linux, solidity, swift tasks and projects","flask,java,django,linux,solidity,swift"
818,Frontend Manager,"Responsible for solidity, azure, swift, node, linux tasks and projects","solidity,azure,swift,node,linux"
819,Marketing Analyst,"Responsible for pytorch, swift, node tasks and projects","pytorch,swift,node"
820,DevOps Analyst,"Responsible for node, nlp, azure, pytorch, flutter tasks and projects","node,nlp,azure,pytorch,flutter"
821,Cloud Developer,"Responsible for unity, solidity, nlp, pytorch, spark tasks and projects","unity,solidity,nlp,pytorch,spark"
822,Frontend Designer,"Responsible for python, aws, c++, tensorflow, sql, pandas tasks and projects","python,aws,c++,tensorflow,sql,pandas"
823,DevOps Developer,"Responsible for nlp, c#, tensorflow tasks and projects","nlp,c#,tensorflow"
824,Blockchain Architect,"Responsible for pytorch, react, figma, c#, adobe xd tasks and projects","pytorch,react,figma,c#,adobe xd"
825,Full Stack Engineer,"Responsible for linux, cloud, swift, flutter tasks and projects","linux,cloud,swift,flutter"
826,Cloud Scientist,"Responsible for tensorflow, docker, pandas, css, python, react tasks and projects","tensorflow,docker,pandas,css,python,react"
827,Cloud Architect,"Responsible for node, css, c#, swift, pytorch, javascript tasks and projects","node,css,c#,swift,pytorch,javascript"
828,Frontend Developer,"Responsible for git, css, kubernetes, django, javascript, pandas tasks and projects","git,css,kubernetes,django,javascript,pandas"
829,Full Stack Consultant,"Responsible for docker, tensorflow, java tasks and projects","docker,tensorflow,java"
830,Game Consultant,"Responsible for pandas, spark, swift, kubernetes, aws, figma tasks and projects","pandas,spark,swift,kubernetes,aws,figma"
831,Robotics Engineer,"Responsible for cloud, spark, docker, linux, node tasks and projects","cloud,spark,docker,linux,node"
832,Full Stack Analyst,"Responsible for airflow, adobe xd, flask, flutter, numpy, javascript tasks and projects","airflow,adobe xd,flask,flutter,numpy,javascript"
833,DevOps Specialist,"Responsible for solidity, nlp, kotlin, javascript tasks and projects","solidity,nlp,kotlin,javascript"
834,Embedded Administrator,"Responsible for adobe xd, cloud, pandas, c#, css tasks and projects","adobe xd,cloud,pandas,c#,css"
835,Blockchain Manager,"Responsible for kubernetes, linux, pytorch, azure, css, airflow tasks and projects","kubernetes,linux,pytorch,azure,css,airflow"
836,QA Manager,"Responsible for django, tensorflow, node tasks and projects","django,tensorflow,node"
837,Marketing Administrator,"Responsible for kubernetes, solidity, kotlin, unity, tensorflow tasks and projects","kubernetes,solidity,kotlin,unity,tensorflow"
838,QA Developer,"Responsible for c#, kubernetes, solidity, tensorflow, spark tasks and projects","c#,kubernetes,solidity,tensorflow,spark"
839,Cloud Consultant,"Responsible for html, node, c# tasks and projects","html,node,c#"
840,Data Manager,"Responsible for cloud, unity, airflow, c++, django tasks and projects","cloud,unity,airflow,c++,django"
841,Mobile Scientist,"Responsible for azure, adobe xd, swift, sql, airflow, django tasks and projects","azure,adobe xd,swift,sql,airflow,django"
842,Full Stack Engineer,"Responsible for numpy, node, linux, flask, solidity, sql tasks and projects","numpy,node,linux,flask,solidity,sql"
843,Cloud Administrator,"Responsible for kotlin, pytorch, aws, c++ tasks and projects","kotlin,pytorch,aws,c++"
